{"schemaVersion":"1.0","kind":"linux-filesystem-health","targetRef":"disk-2/volume-1","filesystem":"ntfs","state":"repair-required","checkMode":"ntfsfix-no-action","mountedAtCheck":false,"finding":{"ruleId":"KA-LNX-FS-001","ruleVersion":1,"severity":"critical","summary":"The fixed read-only filesystem check reports errors that require repair.","nextAction":"Back up recoverable data, then use the operating system's native repair workflow with explicit write authorization; KernAid did not modify this filesystem."}}
